2024;NORTE;AC;CRUZEIRO DO SUL;1200203;'04033254000167;ESCOLA JOAQUIM NOGUEIRA;12000779;ADMINISTRAÇÃO PÚBLICA ESTADUAL;315;'11489623000196;COMITE EXECUTIVO JOAQUIM NOGUEIRA;PDDE EQUIDADE;Sala de Recursos Multifuncionais 2024;4000;16000;20000;24/06/2024
2024;NORTE;AC;CRUZEIRO DO SUL;1200203;'04033254000167;ESC JOSE DE ALENCAR;12000787;ADMINISTRAÇÃO PÚBLICA ESTADUAL;20;'03321391000134;COMITE EXECUTIVO CONSORCIO JOSE DE ALENCAR;PDDE EQUIDADE;PDDE ÁGUA 2023;20000;5000;25000;13/06/2024
2024;NORTE;AC;CRUZEIRO DO SUL;1200203;'04033254000167;ESC JOSE DE ALENCAR;12000787;ADMINISTRAÇÃO PÚBLICA ESTADUAL;20;'03321391000134;COMITE EXECUTIVO CONSORCIO JOSE DE ALENCAR;PDDE EQUIDADE;Sala de Recursos Multifuncionais 2024;4000;16000;20000;24/06/2024
2024;NORTE;AC;CRUZEIRO DO SUL;1200203;'04033254000167;ESC SAO FRANCISCO;12001406;ADMINISTRAÇÃO PÚBLICA ESTADUAL;106;'27311176000110;COMITE EXECUTIVO CONSORCIO SAO FRANCISCO;PDDE EQUIDADE;PDDE ÁGUA 2021;20000;5000;25000;01/07/2024
2024;NORTE;AC;CRUZEIRO DO SUL;1200203;'04033254000167;ESC SAO FRANCISCO;12001406;ADMINISTRAÇÃO PÚBLICA ESTADUAL;106;'27311176000110;COMITE EXECUTIVO CONSORCIO SAO FRANCISCO;PDDE EQUIDADE;Sala de Recursos Multifuncionais 2024;4000;16000;20000;24/06/2024
2024;NORTE;AC;CRUZEIRO DO SUL;1200203;'04033254000167;ESC SEBASTIANA SILENE VALENTE;12001490;ADMINISTRAÇÃO PÚBLICA ESTADUAL;146;'04463040000120;COMITE EXECUTIVO CONSORCIO SEBASTIANA SILENE VALENTE;PDDE EQUIDADE;Sala de Recursos Multifuncionais 2024;4000;16000;20000;24/06/2024
2024;NORTE;AC;MANCIO LIMA;1200336;'04033254000167;ESC 1º DE MAIO;12001805;ADMINISTRAÇÃO PÚBLICA ESTADUAL;400;'01227728000113;COMITE EXECUTIVO 1 DE MAIO;PDDE EQUIDADE;PDDE Campo 2021;20924,4;8967,6;29892;14/11/2024
2024;NORTE;AC;MANCIO LIMA;1200336;'04033254000167;ESC INDIGENA IXUBAY RABUI PUYANAWA;12001821;ADMINISTRAÇÃO PÚBLICA ESTADUAL;248;'03140220000109;COMITE EXECUTIVO IXUBAY RABUI PUYANAWA;PDDE EQUIDADE;PDDE Campo 2021;20924,4;8967,6;29892;03/12/2024
2024;NORTE;AC;MANCIO LIMA;1200336;'04059671000189;ESC ARTUR LEBRE;12001953;ADMINISTRAÇÃO PÚBLICA MUNICIPAL;213;'02928470000145;CONSELHO ESCOLAR RENOVACAO EDUCACIONAL;PDDE EQUIDADE;PDDE Campo 2021;20924,4;8967,6;29892;12/06/2024
2024;NORTE;AC;MANCIO LIMA;1200336;'04059671000189;ESC ARTUR LEBRE;12001953;ADMINISTRAÇÃO PÚBLICA MUNICIPAL;213;'02928470000145;CONSELHO ESCOLAR RENOVACAO EDUCACIONAL;PDDE EQUIDADE;Sala de Recursos Multifuncionais 2024;4000;16000;20000;24/06/2024
2024;NORTE;AC;MANCIO LIMA;1200336;'04059671000189;ESC GERZUILO EUDES DE OLIVEIRA;12002054;ADMINISTRAÇÃO PÚBLICA MUNICIPAL;21;'02919257000177;CONSELHO ESCOLAR MARIA EUNICE PEREIRA DA SILVA;PDDE EQUIDADE;PDDE ÁGUA 2021;20000;5000;25000;17/05/2024
2024;NORTE;AC;MANCIO LIMA;1200336;'04059671000189;ESC JOAQUIM GENEROSO DE OLIVEIRA;12002127;ADMINISTRAÇÃO PÚBLICA MUNICIPAL;144;'01228773000192;CONSELHO ESCOLAR VOVO AURELIANO;PDDE EQUIDADE;Sala de Recursos Multifuncionais 2024;4000;16000;20000;24/06/2024
2024;NORTE;AC;MANCIO LIMA;1200336;'04059671000189;ESC JOSE SENA;12002178;ADMINISTRAÇÃO PÚBLICA MUNICIPAL;70;'02903170000101;CONSELHO ESCOLAR RAIMUNDO CRUZ DO NASCIMENTO;PDDE EQUIDADE;PDDE Campo 2021;18134,9;7772,1;25907;14/11/2024
2024;NORTE;AC;MANCIO LIMA;1200336;'04059671000189;ESC JOSE SENA;12002178;ADMINISTRAÇÃO PÚBLICA MUNICIPAL;70;'02903170000101;CONSELHO ESCOLAR RAIMUNDO CRUZ DO NASCIMENTO;PDDE EQUIDADE;Sala de Recursos Multifuncionais 2024;4000;16000;20000;14/11/2024
2024;NORTE;AC;MANCIO LIMA;1200336;'04059671000189;ESC LUIZ DE FONTES;12002208;ADMINISTRAÇÃO PÚBLICA MUNICIPAL;13;'02903171000156;CONSELHO ESCOLAR DAMIAO MENDES DA SILVA;PDDE EQUIDADE;PDDE ÁGUA 2021;22400;5600;28000;14/11/2024
2024;NORTE;AC;MANCIO LIMA;1200336;'04059671000189;ESC MANCIO LIMA;12002224;ADMINISTRAÇÃO PÚBLICA MUNICIPAL;67;'03252062000189;CONSELHO ESCOLAR PE DA TERRA;PDDE EQUIDADE;PDDE ÁGUA 2021;22400;5600;28000;20/06/2024
2024;NORTE;AC;MANCIO LIMA;1200336;'04059671000189;ESC MANCIO LIMA;12002224;ADMINISTRAÇÃO PÚBLICA MUNICIPAL;67;'03252062000189;CONSELHO ESCOLAR PE DA TERRA;PDDE EQUIDADE;Sala de Recursos Multifuncionais 2024;4000;16000;20000;24/06/2024
2024;NORTE;AC;MANCIO LIMA;1200336;'04033254000167;ESC INDIGENA PEDRO ANTONIO DE OLIVEIRA;12002275;ADMINISTRAÇÃO PÚBLICA ESTADUAL;119;'03013246000196;COMITE EXECUTIVO PEDRO ANTONIO DE OLIVEIRA;PDDE EQUIDADE;Sala de Recursos Multifuncionais 2024;4000;16000;20000;26/11/2024
2024;NORTE;AC;MANCIO LIMA;1200336;'04059671000189;ESC PROFª MARIA ADALCY COSTA DE MATOS;12002380;ADMINISTRAÇÃO PÚBLICA MUNICIPAL;25;'01228772000148;ESCOLA DE PRIMEIRO GRAU TENENTE BARBOSA;PDDE EQUIDADE;PDDE ÁGUA 2021;20000;5000;25000;14/11/2024
2024;NORTE;AC;MANCIO LIMA;1200336;'04059671000189;ESC BRAULINO VIEIRA DE ALENCAR;12002399;ADMINISTRAÇÃO PÚBLICA MUNICIPAL;197;'09535041000157;CONSELHO ESCOLAR CONSORCIO ANGELITA DE OLIVEIRA COSTA;PDDE EQUIDADE;Sala de Recursos Multifuncionais 2024;4000;16000;20000;14/11/2024
2024;NORTE;AC;MARECHAL THAUMATURGO;1200351;'84306463000176;ESC 24 DE JANEIRO;12002410;ADMINISTRAÇÃO PÚBLICA MUNICIPAL;66;'03298430000120;CONSELHO VINTE QUATRO DE JANEIRO;PDDE EQUIDADE;Sala de Recursos Multifuncionais 2024;4000;16000;20000;01/07/2024
2024;NORTE;AC;MARECHAL THAUMATURGO;1200351;'84306463000176;ESC ANTONIO RUBENS PINHEIRO;12002461;ADMINISTRAÇÃO PÚBLICA MUNICIPAL;121;'11299030000167;CONSELHO ESCOLAR EDUCACAO PARA TODOS;PDDE EQUIDADE;Sala de Recursos Multifuncionais 2024;4000;16000;20000;01/07/2024
2024;NORTE;AC;MARECHAL THAUMATURGO;1200351;'84306463000176;ESC JUSTINIANO DE SERPA;12002771;ADMINISTRAÇÃO PÚBLICA MUNICIPAL;581;'01909394000168;CONSELHO ESCOLAR EDUCAR E CONSTRUIR;PDDE EQUIDADE;Sala de Recursos Multifuncionais 2022;4000;16000;20000;04/12/2024
2024;NORTE;AC;MARECHAL THAUMATURGO;1200351;'84306463000176;ESC INDIGENA SAMUEL PIANKO;12002909;ADMINISTRAÇÃO PÚBLICA MUNICIPAL;261;'08993523000198;CONSELHO ESCOLAR IYOTATSI;PDDE EQUIDADE;PDDE Campo - 2024;20224,4;8667,6;28892;09/12/2024
2024;NORTE;AC;MARECHAL THAUMATURGO;1200351;'84306463000176;ESC INDIGENA SAMUEL PIANKO;12002909;ADMINISTRAÇÃO PÚBLICA MUNICIPAL;261;'08993523000198;CONSELHO ESCOLAR IYOTATSI;PDDE EQUIDADE;Sala de Recursos Multifuncionais 2024;4000;16000;20000;14/11/2024
2024;NORTE;AC;MARECHAL THAUMATURGO;1200351;'84306463000176;ESC SAO RAIMUNDO;12002925;ADMINISTRAÇÃO PÚBLICA MUNICIPAL;126;'11295741000163;CONSELHO ESCOLAR EDUCACAO INTEGRATIVA;PDDE EQUIDADE;Sala de Recursos Multifuncionais 2024;4000;16000;20000;14/11/2024
2024;NORTE;AC;MARECHAL THAUMATURGO;1200351;'84306463000176;ESC ZILDA VASCONCELOS;12002950;ADMINISTRAÇÃO PÚBLICA MUNICIPAL;236;'03248103000163;CONSELHO ESCOLAR ZILDA VASCONCELOS;PDDE EQUIDADE;Sala de Recursos Multifuncionais 2024;4000;16000;20000;14/11/2024
2024;NORTE;AC;PORTO WALTER;1200393;'63603625000168;ESC ALMIRANTE TAMANDARE;12003018;ADMINISTRAÇÃO PÚBLICA MUNICIPAL;155;'03519069000114;CONSELHO ESCOLAR ALMIRANTE TAMANDARE;PDDE EQUIDADE;Sala de Recursos Multifuncionais 2024;4000;16000;20000;24/06/2024
2024;NORTE;AC;PORTO WALTER;1200393;'63603625000168;ESC HELENA NOBRE;12003190;ADMINISTRAÇÃO PÚBLICA MUNICIPAL;124;'03520043000196;CONSELHO ESCOLAR HELENA NOBRE;PDDE EQUIDADE;Sala de Recursos Multifuncionais 2024;4000;16000;20000;24/06/2024
2024;NORTE;AC;PORTO WALTER;1200393;'63603625000168;ESC OTONIEL DE SOUZA;12003417;ADMINISTRAÇÃO PÚBLICA MUNICIPAL;85;'11216886000121;CONSELHO ESCOLAR OTONIEL DE SOUZA;PDDE EQUIDADE;Sala de Recursos Multifuncionais 2024;4000;16000;20000;01/07/2024
2024;NORTE;AC;RODRIGUES ALVES;1200427;'84306455000120;ESC GABRIEL ARCANJO DO NASCIMENTO;12003670;ADMINISTRAÇÃO PÚBLICA MUNICIPAL;79;'11190598000145;CONSELHO ESCOLAR GABRIEL ARCANJO DO NASCIMENTO;PDDE EQUIDADE;PDDE ÁGUA 2021;22400;5600;28000;20/06/2024
2024;NORTE;AC;RODRIGUES ALVES;1200427;'84306455000120;ESC HIDELBRANDO FABRICIO ANGELO;12003719;ADMINISTRAÇÃO PÚBLICA MUNICIPAL;24;'11190810000174;CONSELHO ESCOLAR HILDEBRANDO FABRICIO ANGELO;PDDE EQUIDADE;PDDE ÁGUA 2021;20000;5000;25000;20/06/2024
2024;NORTE;AC;RODRIGUES ALVES;1200427;'84306455000120;ESC HIDELBRANDO FABRICIO ANGELO;12003719;ADMINISTRAÇÃO PÚBLICA MUNICIPAL;24;'11190810000174;CONSELHO ESCOLAR HILDEBRANDO FABRICIO ANGELO;PDDE EQUIDADE;PDDE Campo - 2024;16181,9;6935,1;23117;09/12/2024
2024;NORTE;AC;RODRIGUES ALVES;1200427;'84306455000120;ESC JOAO SALVIANO MARTINS DA SILVA;12003735;ADMINISTRAÇÃO PÚBLICA MUNICIPAL;31;'11190736000196;CONSELHO ESCOLAR JOAO SALVIANO MARTINS DA SILVA;PDDE EQUIDADE;PDDE ÁGUA 2021;20000;5000;25000;20/06/2024
2024;NORTE;AC;RODRIGUES ALVES;1200427;'84306455000120;ESC JOAQUIM BARROSO I;12003751;ADMINISTRAÇÃO PÚBLICA MUNICIPAL;36;'41619611000108;COMITE EXECUTIVO CONSORCIO FRANCISCO DAS CHAGAS SILVA;PDDE EQUIDADE;PDDE ÁGUA 2021;20000;5000;25000;17/05/2024
2024;NORTE;AC;RODRIGUES ALVES;1200427;'84306455000120;ESC MANUEL DE MOURA;12003816;ADMINISTRAÇÃO PÚBLICA MUNICIPAL;110;'08749480000108;CONSELHO ESCOLAR MANOEL DE MOURA;PDDE EQUIDADE;PDDE ÁGUA 2021;22400;5600;28000;20/06/2024
2024;NORTE;AC;RODRIGUES ALVES;1200427;'84306455000120;ESC MANUEL DE MOURA;12003816;ADMINISTRAÇÃO PÚBLICA MUNICIPAL;110;'08749480000108;CONSELHO ESCOLAR MANOEL DE MOURA;PDDE EQUIDADE;Sala de Recursos Multifuncionais 2024;4000;16000;20000;24/06/2024
2024;NORTE;AC;RODRIGUES ALVES;1200427;'84306455000120;ESC MARECHAL RONDON;12003824;ADMINISTRAÇÃO PÚBLICA MUNICIPAL;122;'47396534000142;CONSELHO ESCOLAR MARECHAL RONDON;PDDE EQUIDADE;Sala de Recursos Multifuncionais 2024;4000;16000;20000;24/06/2024
2024;NORTE;AC;RODRIGUES ALVES;1200427;'84306455000120;ESC MARIA DE NAZARE PEREIRA DA SILVA;12003840;ADMINISTRAÇÃO PÚBLICA MUNICIPAL;46;'41619611000108;COMITE EXECUTIVO CONSORCIO FRANCISCO DAS CHAGAS SILVA;PDDE EQUIDADE;PDDE ÁGUA 2021;20000;5000;25000;17/05/2024
2024;NORTE;AC;RODRIGUES ALVES;1200427;'84306455000120;ESC SAO FRANCISCO;12003921;ADMINISTRAÇÃO PÚBLICA MUNICIPAL;39;'11225288000119;CONSELHO ESCOLAR SAO FRANCISCO;PDDE EQUIDADE;PDDE ÁGUA 2021;20000;5000;25000;20/06/2024
2024;NORTE;AC;FEIJO;1200302;'04005179000120;ESC ANTONIO FENELON DE OLIVEIRA;12004014;ADMINISTRAÇÃO PÚBLICA MUNICIPAL;264;'19573771000104;COMITE EXECUTIVO ANTONIO FENELON DE OLIVEIRA;PDDE EQUIDADE;Sala de Recursos Multifuncionais 2024;4000;16000;20000;14/11/2024
2024;NORTE;AC;FEIJO;1200302;'04005179000120;ESC CARLOS FEIJO DE MELO;12004090;ADMINISTRAÇÃO PÚBLICA MUNICIPAL;20;'12143916000180;COMITE EXECUTIVO CONSROCIO FORCA DO ALTO;PDDE EQUIDADE;PDDE ÁGUA 2023;20000;5000;25000;14/11/2024
2024;NORTE;AC;FEIJO;1200302;'04033254000167;ESC DOM PEDRO I;12004120;ADMINISTRAÇÃO PÚBLICA ESTADUAL;193;'11657363000110;COMITE EXECUTIVO DOM PEDRO I;PDDE EQUIDADE;Sala de Recursos Multifuncionais 2024;4000;16000;20000;24/06/2024
2024;NORTE;AC;FEIJO;1200302;'04005179000120;ESC EUGENIA MORAIS DA SILVEIRA;12004243;ADMINISTRAÇÃO PÚBLICA MUNICIPAL;222;'12008233000110;COMITE EXECUTIVO EUGENIA MORAIS;PDDE EQUIDADE;Sala de Recursos Multifuncionais 2024;4000;16000;20000;14/11/2024
2024;NORTE;AC;FEIJO;1200302;'04005179000120;ESC FRANCISCO CORIOLANO DE SOUZA;12004308;ADMINISTRAÇÃO PÚBLICA MUNICIPAL;39;'12144498000145;COMITE EXECUTIVO CONSORCIO EXTREMA;PDDE EQUIDADE;PDDE Campo 2022;20924,4;8967,6;29892;14/11/2024
2024;NORTE;AC;FEIJO;1200302;'04033254000167;ESC FRANCISCO NUNES LEITAO;12004367;ADMINISTRAÇÃO PÚBLICA ESTADUAL;660;'01221164000101;COMITE EXECUTIVO FRANCISCO NUNES LEITAO;PDDE EQUIDADE;Sala de Recursos Multifuncionais 2024;4000;16000;20000;26/11/2024
2024;NORTE;AC;FEIJO;1200302;'04033254000167;ESC FRANCISCO WULISSES DE MEDEIROS;12004413;ADMINISTRAÇÃO PÚBLICA ESTADUAL;368;'11657299000178;COMITE EXECUTIVO CONSORCIO FRANCISCO WLISSES DE MEDEIROS;PDDE EQUIDADE;PDDE Campo 2021;20924,4;8967,6;29892;14/11/2024
2024;NORTE;AC;FEIJO;1200302;'04033254000167;ESC FRANCISCO WULISSES DE MEDEIROS;12004413;ADMINISTRAÇÃO PÚBLICA ESTADUAL;368;'11657299000178;COMITE EXECUTIVO CONSORCIO FRANCISCO WLISSES DE MEDEIROS;PDDE EQUIDADE;Sala de Recursos Multifuncionais 2024;4000;16000;20000;24/06/2024
2024;NORTE;AC;FEIJO;1200302;'04005179000120;ESC GENI NUNES LEITAO DAMASCENO;12004430;ADMINISTRAÇÃO PÚBLICA MUNICIPAL;22;'12144498000145;COMITE EXECUTIVO CONSORCIO EXTREMA;PDDE EQUIDADE;PDDE ÁGUA 2023;20000;5000;25000;14/11/2024
2024;NORTE;AC;FEIJO;1200302;'04005179000120;ESC JOEL FERREIRA DE SOUZA;12004537;ADMINISTRAÇÃO PÚBLICA MUNICIPAL;27;'12143583000199;COMITE EXECUTIVO CONSORCIO PORTO ENVIRA;PDDE EQUIDADE;PDDE ÁGUA 2023;20000;5000;25000;14/11/2024
2024;NORTE;AC;FEIJO;1200302;'04005179000120;ESC CORONEL JULIO SANTOS;12004588;ADMINISTRAÇÃO PÚBLICA MUNICIPAL;27;'12144486000110;COMITE EXECUTIVO CONSORCIO BARES;PDDE EQUIDADE;PDDE ÁGUA 2023;20000;5000;25000;14/11/2024
2024;NORTE;AC;FEIJO;1200302;'04033254000167;ESC INDIGENA HUNI KUI SIA;12004596;ADMINISTRAÇÃO PÚBLICA ESTADUAL;201;'07816177000100;COMITE EXECUTIVO HUNI KUI SIA;PDDE EQUIDADE;PDDE ÁGUA 2023;25600;6400;32000;19/06/2024
2024;NORTE;AC;FEIJO;1200302;'04033254000167;ESC INDIGENA HUNI KUI SIA;12004596;ADMINISTRAÇÃO PÚBLICA ESTADUAL;201;'07816177000100;COMITE EXECUTIVO HUNI KUI SIA;PDDE EQUIDADE;PDDE Campo 2021;20924,4;8967,6;29892;03/12/2024
2024;NORTE;AC;FEIJO;1200302;'04033254000167;ESC INDIGENA HUNI KUI SIA;12004596;ADMINISTRAÇÃO PÚBLICA ESTADUAL;201;'07816177000100;COMITE EXECUTIVO HUNI KUI SIA;PDDE EQUIDADE;Sala de Recursos Multifuncionais 2024;4000;16000;20000;24/06/2024
2024;NORTE;AC;FEIJO;1200302;'04033254000167;ESC MANUEL BEZERRA PEDROSA;12004600;ADMINISTRAÇÃO PÚBLICA ESTADUAL;32;'11657332000160;COMITE EXECUTIVO CONSORCIO VICENCIA DE OLIVEIRA;PDDE EQUIDADE;PDDE ÁGUA 2023;20000;5000;25000;13/06/2024
2024;NORTE;AC;FEIJO;1200302;'04033254000167;ESC MANUEL BEZERRA PEDROSA;12004600;ADMINISTRAÇÃO PÚBLICA ESTADUAL;32;'11657332000160;COMITE EXECUTIVO CONSORCIO VICENCIA DE OLIVEIRA;PDDE EQUIDADE;PDDE Campo - 2023;16181,9;6935,1;23117;14/11/2024
2024;NORTE;AC;FEIJO;1200302;'04033254000167;ESC INDIGENA TEKAHAYNE SHANENAWA;12004642;ADMINISTRAÇÃO PÚBLICA ESTADUAL;189;'11211998000190;COMITE EXECUTIVO TEKAHAYNE SHANENAWA;PDDE EQUIDADE;PDDE ÁGUA 2024;25600;6400;32000;18/12/2024
2024;NORTE;AC;FEIJO;1200302;'04005179000120;ESC PEDRO MOTA LEITAO;12004766;ADMINISTRAÇÃO PÚBLICA MUNICIPAL;105;'19555144000132;COMITE EXETIVO PEDRO MOTA LEITAO;PDDE EQUIDADE;Sala de Recursos Multifuncionais 2024;4000;16000;20000;26/11/2024
2024;NORTE;AC;FEIJO;1200302;'04005179000120;ESC RAIMUNDO PRADO;12004812;ADMINISTRAÇÃO PÚBLICA MUNICIPAL;41;'12143916000180;COMITE EXECUTIVO CONSROCIO FORCA DO ALTO;PDDE EQUIDADE;PDDE ÁGUA 2023;20000;5000;25000;14/11/2024
2024;NORTE;AC;FEIJO;1200302;'04033254000167;ESC SANTO ANTONIO I;12004847;ADMINISTRAÇÃO PÚBLICA ESTADUAL;398;'11657266000128;COMITE EXECUTIVO SANTO ANTONIO I;PDDE EQUIDADE;PDDE Campo 2021;20924,4;8967,6;29892;14/11/2024
2024;NORTE;AC;FEIJO;1200302;'04033254000167;ESC SANTO ANTONIO I;12004847;ADMINISTRAÇÃO PÚBLICA ESTADUAL;398;'11657266000128;COMITE EXECUTIVO SANTO ANTONIO I;PDDE EQUIDADE;Sala de Recursos Multifuncionais 2024;4000;16000;20000;24/06/2024
2024;NORTE;AC;FEIJO;1200302;'04005179000120;ESC SAO SEBASTIAO;12004928;ADMINISTRAÇÃO PÚBLICA MUNICIPAL;19;'12144486000110;COMITE EXECUTIVO CONSORCIO BARES;PDDE EQUIDADE;PDDE ÁGUA 2023;20000;5000;25000;14/11/2024
2024;NORTE;AC;JORDAO;1200328;'84306497000160;ESC ALBIA PINHEIRO DO VALE;12005070;ADMINISTRAÇÃO PÚBLICA MUNICIPAL;37;'14604055000115;CONSELHO ESCOLAR CONSORCIO ALTO TARAUACA;PDDE EQUIDADE;PDDE ÁGUA 2023;20000;5000;25000;12/06/2024
2024;NORTE;AC;JORDAO;1200328;'84306497000160;ESC ALBIA PINHEIRO DO VALE;12005070;ADMINISTRAÇÃO PÚBLICA MUNICIPAL;37;'14604055000115;CONSELHO ESCOLAR CONSORCIO ALTO TARAUACA;PDDE EQUIDADE;Sala de Recursos Multifuncionais 2024;4000;16000;20000;24/06/2024
2024;NORTE;AC;JORDAO;1200328;'84306497000160;ESC AMAZILIO SAMPAIO;12005088;ADMINISTRAÇÃO PÚBLICA MUNICIPAL;51;'14027178000130;CONSELHO ESCOLAR CONSORCIO LUZ DIVINA;PDDE EQUIDADE;Sala de Recursos Multifuncionais 2024;4000;16000;20000;24/06/2024
2024;NORTE;AC;JORDAO;1200328;'84306497000160;ESC AMELIA GONCALVES DE FARIAS;12005096;ADMINISTRAÇÃO PÚBLICA MUNICIPAL;35;'14604055000115;CONSELHO ESCOLAR CONSORCIO ALTO TARAUACA;PDDE EQUIDADE;PDDE ÁGUA 2023;20000;5000;25000;12/06/2024
2024;NORTE;AC;JORDAO;1200328;'84306497000160;ESC ATALIBA XIMENES ARAGAO;12005100;ADMINISTRAÇÃO PÚBLICA MUNICIPAL;46;'07578051000144;CONSELHO ESCOLAR OSVALDO SOBRALINO;PDDE EQUIDADE;Sala de Recursos Multifuncionais 2024;4000;16000;20000;24/06/2024
2024;NORTE;AC;JORDAO;1200328;'84306497000160;ESC CORONEL FLORENCIO DA CUNHA;12005142;ADMINISTRAÇÃO PÚBLICA MUNICIPAL;59;'12113028000114;CONSELHO ESCOLAR CONSORCIO SALVADOR;PDDE EQUIDADE;Sala de Recursos Multifuncionais 2024;4000;16000;20000;24/06/2024
2024;NORTE;AC;JORDAO;1200328;'84306497000160;ESC NOSSA SENHORA DE GUADALUPE;12005290;ADMINISTRAÇÃO PÚBLICA MUNICIPAL;32;'12113028000114;CONSELHO ESCOLAR CONSORCIO SALVADOR;PDDE EQUIDADE;Sala de Recursos Multifuncionais 2024;4000;16000;20000;24/06/2024
2024;NORTE;AC;TARAUACA;1200609;'34693564000179;ESC 15 DE JUNHO II;12005401;ADMINISTRAÇÃO PÚBLICA MUNICIPAL;177;'03482500000103;COMITE EXECUTIVO BOA ESPERANCA;PDDE EQUIDADE;Sala de Recursos Multifuncionais 2024;4000;16000;20000;14/11/2024
2024;NORTE;AC;TARAUACA;1200609;'04033254000167;ESC ARIVAN CARNEIRO PRADO;12005517;ADMINISTRAÇÃO PÚBLICA ESTADUAL;253;'11396227000114;COMITE EXECUTIVO CONSORCIO AURORA;PDDE EQUIDADE;Sala de Recursos Multifuncionais 2024;4000;16000;20000;24/06/2024
2024;NORTE;AC;TARAUACA;1200609;'04033254000167;ESC BOM JESUS;12005541;ADMINISTRAÇÃO PÚBLICA ESTADUAL;140;'11396188000155;COMITE EXECUTIVO CONSORCIO ITAMARATY;PDDE EQUIDADE;PDDE ÁGUA 2021;22400;5600;28000;01/07/2024
2024;NORTE;AC;TARAUACA;1200609;'04033254000167;ESC BOM JESUS;12005541;ADMINISTRAÇÃO PÚBLICA ESTADUAL;140;'11396188000155;COMITE EXECUTIVO CONSORCIO ITAMARATY;PDDE EQUIDADE;PDDE Campo 2021;18134,9;7772,1;25907;03/12/2024
2024;NORTE;AC;TARAUACA;1200609;'04033254000167;ESC INDIGENA IVA STTIHO;12005550;ADMINISTRAÇÃO PÚBLICA ESTADUAL;102;'03485322000166;COMITE EXECUTIVO IVA STTIHO;PDDE EQUIDADE;Sala de Recursos Multifuncionais 2024;4000;16000;20000;24/06/2024
2024;NORTE;AC;TARAUACA;1200609;'34693564000179;ESC CEL JOSE MARQUES DE ALBUQUERQUE;12005592;ADMINISTRAÇÃO PÚBLICA MUNICIPAL;200;'06334310000129;COMITE EXECUTIVO PARAISO;PDDE EQUIDADE;Sala de Recursos Multifuncionais 2024;4000;16000;20000;01/07/2024
2024;NORTE;AC;TARAUACA;1200609;'04033254000167;ESC INDIGENA ESTIRAO DO CAUCHO I;12005827;ADMINISTRAÇÃO PÚBLICA ESTADUAL;295;'05805914000143;COMITE EXECUTIVO ESTIRAO DO CAUCHO;PDDE EQUIDADE;PDDE Campo 2021;20924,4;8967,6;29892;03/12/2024
2024;NORTE;AC;TARAUACA;1200609;'04033254000167;ESC INDIGENA ESTIRAO DO CAUCHO I;12005827;ADMINISTRAÇÃO PÚBLICA ESTADUAL;295;'05805914000143;COMITE EXECUTIVO ESTIRAO DO CAUCHO;PDDE EQUIDADE;Sala de Recursos Multifuncionais 2024;4000;16000;20000;24/06/2024
2024;NORTE;AC;TARAUACA;1200609;'04033254000167;ESC LIDIA GUIOMARD DOS SANTOS;12005967;ADMINISTRAÇÃO PÚBLICA ESTADUAL;296;'11396188000155;COMITE EXECUTIVO CONSORCIO ITAMARATY;PDDE EQUIDADE;Sala de Recursos Multifuncionais 2024;4000;16000;20000;24/06/2024
2024;NORTE;AC;TARAUACA;1200609;'04033254000167;ESC MARIA DE LOURDES ALBUQUERQUE DOS SANTOS;12006076;ADMINISTRAÇÃO PÚBLICA ESTADUAL;132;'11396164000104;COMITE EXECUTIVO CONSORCIO VITORIA;PDDE EQUIDADE;Sala de Recursos Multifuncionais 2024;4000;16000;20000;24/06/2024
2024;NORTE;AC;TARAUACA;1200609;'04033254000167;ESC MARIA DE LOURDES SANTOS CATAO;12006084;ADMINISTRAÇÃO PÚBLICA ESTADUAL;297;'11396227000114;COMITE EXECUTIVO CONSORCIO AURORA;PDDE EQUIDADE;PDDE ÁGUA 2022;25600;6400;32000;27/06/2024
2024;NORTE;AC;TARAUACA;1200609;'04033254000167;ESC MARIA DE LOURDES SANTOS CATAO;12006084;ADMINISTRAÇÃO PÚBLICA ESTADUAL;297;'11396227000114;COMITE EXECUTIVO CONSORCIO AURORA;PDDE EQUIDADE;PDDE Campo 2022;20924,4;8967,6;29892;14/11/2024
2024;NORTE;AC;TARAUACA;1200609;'04033254000167;ESC MARIA DE LOURDES SANTOS CATAO;12006084;ADMINISTRAÇÃO PÚBLICA ESTADUAL;297;'11396227000114;COMITE EXECUTIVO CONSORCIO AURORA;PDDE EQUIDADE;Sala de Recursos Multifuncionais 2024;4000;16000;20000;24/06/2024
2024;NORTE;AC;MANOEL URBANO;1200344;'04033254000167;ESC ANTONIO NASCIMENTO;12006602;ADMINISTRAÇÃO PÚBLICA ESTADUAL;186;'11509920000156;COMITE EXECUTIVO CONSORCIO JUNTOS CONSTRUIMOS;PDDE EQUIDADE;PDDE ÁGUA 2022;22400;5600;28000;14/11/2024
2024;NORTE;AC;MANOEL URBANO;1200344;'04033254000167;ESC GERALDO GURGEL DE MESQUITA;12006750;ADMINISTRAÇÃO PÚBLICA ESTADUAL;94;'11509920000156;COMITE EXECUTIVO CONSORCIO JUNTOS CONSTRUIMOS;PDDE EQUIDADE;PDDE Campo 2021;18134,9;7772,1;25907;14/11/2024
2024;NORTE;AC;SENA MADUREIRA;1200500;'04033254000167;ESC AFONSO PENA;12007307;ADMINISTRAÇÃO PÚBLICA ESTADUAL;42;'11815126000130;COMITE EXECUTIVO CONSORCIO SENADOR ADALBERTO SENA;PDDE EQUIDADE;PDDE ÁGUA 2023;20000;5000;25000;14/11/2024
2024;NORTE;AC;SENA MADUREIRA;1200500;'04033254000167;ESC ITAMARATY;12007935;ADMINISTRAÇÃO PÚBLICA ESTADUAL;49;'08701940000110;COMITE EXECUTIVO ITAMARATY;PDDE EQUIDADE;Sala de Recursos Multifuncionais 2024;4000;16000;20000;24/06/2024
2024;NORTE;AC;SENA MADUREIRA;1200500;'04033254000167;ESC JOSE PEJOTA DE MORAIS;12008028;ADMINISTRAÇÃO PÚBLICA ESTADUAL;19;'11887286000195;COMITE EXECUTIVO CONSORCIO RECIFE;PDDE EQUIDADE;PDDE ÁGUA 2023;20000;5000;25000;14/11/2024
2024;NORTE;AC;SENA MADUREIRA;1200500;'04033254000167;ESC JOSE PEJOTA DE MORAIS;12008028;ADMINISTRAÇÃO PÚBLICA ESTADUAL;19;'11887286000195;COMITE EXECUTIVO CONSORCIO RECIFE;PDDE EQUIDADE;PDDE Campo - 2023;16181,9;6935,1;23117;14/11/2024
2024;NORTE;AC;ACRELANDIA;1200013;'84306737000127;ESC ALTINA MAGALHAES DA SILVA;12008966;ADMINISTRAÇÃO PÚBLICA MUNICIPAL;384;'02437372000105;CONSELHO ESCOLAR ALTINA MAGALHAES DA SILVA;PDDE EQUIDADE;Sala de Recursos Multifuncionais 2024;4000;16000;20000;14/11/2024
2024;NORTE;AC;ACRELANDIA;1200013;'04033254000167;ESC MARIA DE JESUS RIBEIRO;12009164;ADMINISTRAÇÃO PÚBLICA ESTADUAL;115;'01197089000190;COMITE EXECUTIVO MARIA DE JESUS RIBEIRO;PDDE EQUIDADE;Sala de Recursos Multifuncionais 2024;4000;16000;20000;24/06/2024
2024;NORTE;AC;BUJARI;1200138;'04033254000167;ESC PEDRO ALVARO;12009547;ADMINISTRAÇÃO PÚBLICA ESTADUAL;45;'12013248000176;COMITE EXECUTIVO CONSORCIO ARCO-IRIS;PDDE EQUIDADE;Sala de Recursos Multifuncionais 2024;4000;16000;20000;24/06/2024
2024;NORTE;AC;BUJARI;1200138;'04033254000167;ESC MARIA DO CARMO RAMOS;12009679;ADMINISTRAÇÃO PÚBLICA ESTADUAL;142;'07175927000101;COMITE EXECUTIVO MARIA DO CARMO RAMOS;PDDE EQUIDADE;Sala de Recursos Multifuncionais 2024;4000;16000;20000;24/06/2024
2024;NORTE;AC;BUJARI;1200138;'04033254000167;ESC NOSSA SENHORA DA ESPERANCA;12009687;ADMINISTRAÇÃO PÚBLICA ESTADUAL;98;'12013248000176;COMITE EXECUTIVO CONSORCIO ARCO-IRIS;PDDE EQUIDADE;Sala de Recursos Multifuncionais 2024;4000;16000;20000;24/06/2024
2024;NORTE;AC;PLACIDO DE CASTRO;1200385;'04076733000160;ESC DOMINGOS GALDINO DA SILVA;12010090;ADMINISTRAÇÃO PÚBLICA MUNICIPAL;286;'03171132000174;CONSELHO ESCOLAR DOMINGOS GALDINO;PDDE EQUIDADE;Sala de Recursos Multifuncionais 2024;6400;25600;32000;14/11/2024
2024;NORTE;AC;PLACIDO DE CASTRO;1200385;'04076733000160;ESC PROF CARLOS JOSE DOS SANTOS;12010626;ADMINISTRAÇÃO PÚBLICA MUNICIPAL;126;'03170418000135;CONSELHO ESCOLAR PROF CARLOS JOSE DOS SANTOS;PDDE EQUIDADE;Sala de Recursos Multifuncionais 2024;4000;16000;20000;01/07/2024
2024;NORTE;AC;PLACIDO DE CASTRO;1200385;'04033254000167;ESC SAO LUIZ GONZAGA;12010731;ADMINISTRAÇÃO PÚBLICA ESTADUAL;443;'01180781000106;COMITE EXECUTIVO SAO LUIZ GONZAGA;PDDE EQUIDADE;Sala de Recursos Multifuncionais 2024;6400;25600;32000;24/06/2024
2024;NORTE;AC;PLACIDO DE CASTRO;1200385;'04033254000167;ESC SANTA RITA DE CASSIA;12010790;ADMINISTRAÇÃO PÚBLICA ESTADUAL;37;'11694933000142;COMITE EXECUTIVO CONSORCIO UNIAO;PDDE EQUIDADE;PDDE ÁGUA 2021;20000;5000;25000;01/07/2024
2024;NORTE;AC;RIO BRANCO;1200401;'04033254000167;ESC AGNALDO MORENO;12011070;ADMINISTRAÇÃO PÚBLICA ESTADUAL;136;'12402403000146;COMITE EXECUTIVO CONSORCIO AGNALDO MORENO;PDDE EQUIDADE;Sala de Recursos Multifuncionais 2024;4000;16000;20000;24/06/2024
2024;NORTE;AC;RIO BRANCO;1200401;'04033254000167;ESC ALTO ALEGRE II;12011134;ADMINISTRAÇÃO PÚBLICA ESTADUAL;107;'07444661000155;COMITE EXECUTIVO ALTO ALEGRE II;PDDE EQUIDADE;Sala de Recursos Multifuncionais 2024;4000;16000;20000;26/11/2024
2024;NORTE;AC;RIO BRANCO;1200401;'04033254000167;ESC CLINIO BRANDAO;12011401;ADMINISTRAÇÃO PÚBLICA ESTADUAL;467;'01197088000146;COMITE EXECUTIVO CLINIO BRANDAO;PDDE EQUIDADE;Sala de Recursos Multifuncionais 2024;6400;25600;32000;26/11/2024
2024;NORTE;AC;RIO BRANCO;1200401;'04033254000167;ESC COLEGIO ACREANO;12011428;ADMINISTRAÇÃO PÚBLICA ESTADUAL;935;'01197077000166;COMITE EXECUTIVO COLEGIO ACREANO;PDDE EQUIDADE;Sala de Recursos Multifuncionais 2024;6400;25600;32000;26/11/2024
2024;NORTE;AC;RIO BRANCO;1200401;'04033254000167;ESC NEUTEL MAIA;12011550;ADMINISTRAÇÃO PÚBLICA ESTADUAL;728;'05656654000191;COMITE EXECUTIVO NEUTEL MAIA;PDDE EQUIDADE;Sala de Recursos Multifuncionais 2024;6400;25600;32000;26/11/2024
2024;NORTE;AC;RIO BRANCO;1200401;'04033254000167;ESC MARILDA GOUVEIA VIANA;12011932;ADMINISTRAÇÃO PÚBLICA ESTADUAL;698;'01193724000161;COMITE EXECUTIVO MARILDA GOUVEIA VIANA;PDDE EQUIDADE;Sala de Recursos Multifuncionais 2024;4000;16000;20000;26/11/2024
2024;NORTE;AC;RIO BRANCO;1200401;'04033254000167;ESC NATALINO DA SILVEIRA BRITO;12011959;ADMINISTRAÇÃO PÚBLICA ESTADUAL;452;'01193726000150;COMITE EXECUTIVO NATALINO DA SILVEIRA BRITO;PDDE EQUIDADE;Sala de Recursos Multifuncionais 2024;6400;25600;32000;26/11/2024
2024;NORTE;AC;RIO BRANCO;1200401;'04033254000167;ESC RAIMUNDO HERMINIO DE MELO;12012050;ADMINISTRAÇÃO PÚBLICA ESTADUAL;797;'01187510000182;COMITE EXECUTIVO RAIMUNDO HERMINIO DE MELO;PDDE EQUIDADE;Sala de Recursos Multifuncionais 2024;6400;25600;32000;26/11/2024
